{
  "source_type": "image",
  "score_label": "기억의 습작",
  "requested_output": "Extract visible lead-sheet chord chart into structured review-ready JSON without musical inference.",
  "source_files": [
    "/Users/indegser/Downloads/KakaoTalk_Photo_2026-03-14-16-00-30.jpeg"
  ],
  "notes": [
    "Single photographed page with handwritten chord symbols and rehearsal annotations.",
    "Visible title reads '기억의 습작'.",
    "Visible printed or handwritten labels include verse, chorus, interlude, Coda, Segno, Fade Out, and D.S. notation.",
    "The page is rotated in the source photo and was normalized for review."
  ],
  "constraints": [
    "Do not invent unreadable or implied chart content.",
    "Preserve uncertainty explicitly until review resolves it.",
    "Keep handwritten spellings exactly as seen when chord quality is ambiguous."
  ]
}
